{
  "schema": "design-craft.cross-agent-score.v5",
  "task_id": "same-prompt-motion-review",
  "agent": "codex",
  "verified": true,
  "agent_version": "codex-cli 0.162.1",
  "model": "gpt-6-astra",
  "model_observation": "requested_by_cli",
  "reasoning_profile": "medium",
  "reasoning_observation": "requested_by_cli",
  "runner_os": "macOS-27.0.1-arm64-arm-64bit-Mach-O",
  "date": "2026-10-12",
  "prompt_sha256": "15b25396696901c46fd0dde92cd556d10f30179ca38df969ab796228ce6d207f",
  "scorecard_json_sha256": "5b0b6a0d6df83ce49b9e2c598a9cdd79149efca50a9e12069667bc008462d183",
  "contract_sha256": "10f9092ad2bdbbb3157607736678244a30b968e918ad1b4a30ad51716a970e96",
  "run_manifest_path": "run.codex.json",
  "run_manifest_sha256": "87c4db2d7ba87e6aceda0db626d6c66baccbccb75a1a82ca79c8633b3e349b9a",
  "skill_version": "0.7.0",
  "skill_source_commit": "5c4b85336f941b2e3f305d5eb9b23bdd4bc577f2",
  "skill_source_dirty": false,
  "repo_dirty": true,
  "release_state": "unknown",
  "skill_tree_sha256": "67dc338391514456538c7be9ad3f96f272c43c053c94bc4deb06a8fded1f2abb",
  "skill_path": "$BENCHMARK_WORKSPACE/.agents/skills/design-craft",
  "behavior_domain": "skill-motion-review",
  "behavior_sha256": "e0aa26fe78ce38174a694de284ff6860a41f42f6c8a3a895ef04d33b941afd3f",
  "behavior_source_dirty": false,
  "projected_skill_tree_sha256": "d80520251feebbec592ee6b41c360f4e975299d4e425d383115ee3e27af90f55",
  "provenance_skill_path": "~/Documents/sixseven/codeproject/craft67/packages/design-craft/skills/design-craft",
  "command_summary": "codex exec --ephemeral --sandbox read-only --skip-git-repo-check --ignore-rules -C '$BENCHMARK_WORKSPACE' --model gpt-6-astra -c 'model_reasoning_effort=\"medium\"' --output-last-message '$BENCHMARK_WORKSPACE/.design-craft-host-output.md' -",
  "output_path": "codex-output.md",
  "output_sha256": "ad2b7769f4184a24f7c6860484e3eef39552113c1cf69a8b6d1fe4b4dffc2a56",
  "score": 87,
  "criteria": {
    "style_authority": {
      "passed": true,
      "earned": 13,
      "note": "States a 'calm utility style' operations-sheet read and says the settle must not delay further input, but product-context reasoning is terser than a full component/motion-policy check."
    },
    "reference_selection": {
      "passed": true,
      "earned": 11,
      "note": "Applies spring handoff, projection with velocity bounds, soft-boundary mapping and validation checks, but references are not named or justified; selection is only implicit."
    },
    "anti_generic_redesign": {
      "passed": true,
      "earned": 13,
      "note": "'Should this animate?' gives a conditional yes and removes whole-sheet scaling, decorative bounce and blanket transition: all, though the 'do not animate' reasoning is compact."
    },
    "evidence_level": {
      "passed": true,
      "earned": 13,
      "note": "Labels 'L0 static evidence' and notes runtime unknowns per finding (e.g. 'Computed transitions and frame cost are unknown'), but the evidence labeling is brief."
    },
    "verified_boundary": {
      "passed": true,
      "earned": 13,
      "note": "Verified/Unverified section separates snippet facts from lag, smoothness, frame cost and global accessibility; focus and interruption are covered indirectly via V2/V3 rather than named as unverified."
    },
    "design_moves": {
      "passed": true,
      "earned": 14,
      "note": "M1-M8 include handle feedback, 1:1 transform tracking with pointer capture, presentation interruption, velocity handoff in CSS px/s, bounded projection candidate, r(o)=L*o/(L+|o|) boundaries, and a Reduced Motion commit path. No hysteresis."
    },
    "scope_control": {
      "passed": true,
      "earned": 10,
      "note": "58 lines, five blockers, eight moves, all motion- and validation-focused with crisp V1-V4 checks."
    }
  }
}
