{
  "schema": "design-craft.cross-agent-score.v5",
  "task_id": "same-prompt-motion-review",
  "agent": "codex",
  "verified": true,
  "agent_version": "codex-cli 0.155.1",
  "model": "gpt-5.6-sol",
  "model_observation": "requested_by_cli",
  "reasoning_profile": "max",
  "reasoning_observation": "requested_by_cli",
  "runner_os": "macOS-27.0-arm64-arm-64bit-Mach-O",
  "date": "2026-09-19",
  "prompt_sha256": "15b25396696901c46fd0dde92cd556d10f30179ca38df969ab796228ce6d207f",
  "scorecard_json_sha256": "5b0b6a0d6df83ce49b9e2c598a9cdd79149efca50a9e12069667bc008462d183",
  "contract_sha256": "69f694db240266e509b7efd666c627880175a7cf132ddde3ad651c4820f37122",
  "run_manifest_path": "run.codex.json",
  "run_manifest_sha256": "d4e7459efab185620d1a53e76847862b8a42a828973dea3501347a01ba6fca82",
  "skill_version": "0.7.0",
  "skill_source_commit": "ab0ca1121dd8d257e17fa704f4c4e13353ff92db",
  "skill_source_dirty": false,
  "repo_dirty": true,
  "release_state": "unknown",
  "skill_tree_sha256": "8da53f99d4ac651deeb72b63faf8c6522d009ea69e5aee5e9362e2a89fc1105b",
  "skill_path": "$BENCHMARK_WORKSPACE/.agents/skills/design-craft",
  "behavior_domain": "skill-motion-review",
  "behavior_sha256": "ad51a65df0c61a97a6e8b6c61127e96f7408fbb67e46af5ee170aa6d1d2de621",
  "behavior_source_dirty": false,
  "projected_skill_tree_sha256": "6109f47269d38f29a10aefcce9ae7f9e507361ff241e6ce6b8af2e8d58376d75",
  "provenance_skill_path": "$DESIGN_CRAFT_HOME/skills/design-craft",
  "command_summary": "codex exec --ephemeral --sandbox read-only --skip-git-repo-check --ignore-rules -C '$BENCHMARK_WORKSPACE' --model gpt-5.6-sol -c 'model_reasoning_effort=\"max\"' --output-last-message '$BENCHMARK_WORKSPACE/.design-craft-host-output.md' -",
  "output_path": "codex-output.md",
  "output_sha256": "664180ca74e611349857e7dc90efc3ab10927b45f5cf5103ddeaf119e9e8489b",
  "score": 98,
  "criteria": {
    "style_authority": {
      "passed": true,
      "earned": 15,
      "note": "Preserves calm repeated-use operations context and ties motion to causal feedback and direct manipulation."
    },
    "reference_selection": {
      "passed": true,
      "earned": 13,
      "note": "Applies interaction physics, motion, accessibility and validation concepts; retained output and manifest do not establish exact reference reads."
    },
    "anti_generic_redesign": {
      "passed": true,
      "earned": 15,
      "note": "Questions motion necessity and rejects broad transitions, whole-sheet scaling and decorative bounce."
    },
    "evidence_level": {
      "passed": true,
      "earned": 15,
      "note": "Labels static-only evidence and does not claim measured smoothness, frame rate or device performance."
    },
    "verified_boundary": {
      "passed": true,
      "earned": 15,
      "note": "Separates code-visible defects from browser composition, actual feel, geometry and untested Reduced Motion behavior."
    },
    "design_moves": {
      "passed": true,
      "earned": 15,
      "note": "Eight concrete moves cover direct tracking, transform ownership, interruption, velocity, conditional projection, boundaries and Reduced Motion."
    },
    "scope_control": {
      "passed": true,
      "earned": 10,
      "note": "Stays within five findings and eight motion-specific moves; treats projected target changes as a separate product decision."
    }
  }
}
