{
  "schema": "design-craft.cross-agent-score.v5",
  "task_id": "same-prompt-dashboard-review",
  "agent": "codex",
  "verified": true,
  "agent_version": "codex-cli 0.162.1",
  "model": "gpt-6-astra",
  "model_observation": "requested_by_cli",
  "reasoning_profile": "medium",
  "reasoning_observation": "requested_by_cli",
  "runner_os": "macOS-27.0.1-arm64-arm-64bit-Mach-O",
  "date": "2026-10-11",
  "prompt_sha256": "7fd3c7f14647c8b54cc44ef371f2d7ea56bb77efa89cb8081f09a7b41ae777d6",
  "scorecard_json_sha256": "9b73f89575f83eecd859595a81851a57681987dbb8aee6d3b8230d5827081920",
  "contract_sha256": "5312f07de06bddc0f503cd1787100a6e856aa365a87c7d8fcc30967fa4c178b1",
  "run_manifest_path": "run.codex.json",
  "run_manifest_sha256": "6fbf58defd364ccdb347023d9e394e00702cd3302f0aab29aa352c829dac1299",
  "skill_version": "0.7.0",
  "skill_source_commit": "75c347e1a3c2ef71f378c21f91cddd9d596b4b23",
  "skill_source_dirty": false,
  "repo_dirty": true,
  "release_state": "unknown",
  "skill_tree_sha256": "15dc56c7ce1068cde2a6e8c1eb2fc42e9a9c676ce6c4525d638f5d94e72be73a",
  "skill_path": "$BENCHMARK_WORKSPACE/.agents/skills/design-craft",
  "behavior_domain": "skill-production-review",
  "behavior_sha256": "23f743bd1eadedb3c3c9200063accb2137cfbb3609b970d4cd68d40f41a7ef11",
  "behavior_source_dirty": false,
  "projected_skill_tree_sha256": "07e34fbd214d6829c7480dc3473387e13b9c1ce55371f8a5897b7f45faa4f7e2",
  "provenance_skill_path": "~/Documents/sixseven/codeproject/craft67/packages/design-craft/skills/design-craft",
  "command_summary": "codex exec --ephemeral --sandbox read-only --skip-git-repo-check --ignore-rules -C '$BENCHMARK_WORKSPACE' --model gpt-6-astra -c 'model_reasoning_effort=\"medium\"' --output-last-message '$BENCHMARK_WORKSPACE/.design-craft-host-output.md' -",
  "output_path": "codex-output.md",
  "output_sha256": "f744f7d9e4291483a2d10511987c5a20e69614f36f1dd846d9186672ec29f323",
  "score": 94,
  "criteria": {
    "style_authority": {
      "passed": true,
      "earned": 14,
      "note": "The design read restates the restrained, dense-but-calm enterprise character. M6 maps treatments to \"existing token roles\" with \"No marketing hero treatment\", and it notes that \"Dense data itself is appropriate for this audience.\""
    },
    "reference_selection": {
      "passed": true,
      "earned": 12,
      "note": "Uses the relevant design-craft moves (\"Flat KPI grid -> priority hierarchy\", \"Dashboard card soup -> decision surface\", \"Decorative chart -> diagnostic evidence\") and the L0/L1 evidence tiers. It applies less visible dashboard framing than the others: no surface mode or treatment variant, and no calibration cap."
    },
    "anti_generic_redesign": {
      "passed": true,
      "earned": 14,
      "note": "Frames the problem as a decision sequence (\"scope and freshness -> priority exception -> supporting evidence -> next action\") and promotes the work object over the overview cards. The repair doesn't depend on card chrome."
    },
    "evidence_level": {
      "passed": true,
      "earned": 15,
      "note": "States \"L0 static - prose description only\" and gives a provisional 60-74 band, calling it \"a directional assessment\". It lists typography, polish, accessibility and implementation as \"unscored\"."
    },
    "verified_boundary": {
      "passed": true,
      "earned": 15,
      "note": "Separates Established / Inferred / Unverified. Each finding also has a \"Runtime unknown\" column, and it says \"Unmentioned features are not assumed absent\" and that no browser validation was performed."
    },
    "design_moves": {
      "passed": true,
      "earned": 14,
      "note": "Covers a lead operational state plus a supporting metric strip (M1), an exception queue as a prioritized view of the table (M2), a task-first table (M3) and a context band (M6). The moves are folded into the findings table, so the queue structure is less fully specified than it could be."
    },
    "scope_control": {
      "passed": true,
      "earned": 10,
      "note": "Very tight: 44 lines, 4 blockers and exactly 8 moves. Everything stays within dashboard UI quality and pre-implementation validation."
    }
  }
}
